{
    "event_id": "123e4567-e89b-12d3-a456-426614174001",
    "event_name": "alert.created",
    "correlationId": "0196fb3d-4ad7-7d1e-9f49-5d5148d2babd",
    "source": "core-business",
    "alert_id": "ALT-2026-002",
    "severity": "low",
    "message": "Nhiệt độ phòng vượt ngưỡng cảnh báo nhẹ",
    "timestamp": "2026-08-13T08:40:00+07:00"
  }